ISRC,ISRC (without dashes),Track Type (Audio or Video?),Featured Artist,Track Title,Version,Track Duration,Recording Date
QM-EU3-20-00001,QMEU32000001,Audio,Afrodamus,THIS THE INTRO,Single or Album,02:19,2019
QM-EU3-20-00002,QMEU32000002,Audio,Afrodamus,IF I WAS STINKMEANER,Single or Album,02:40,2019
QM-EU3-20-00003,QMEU32000003,Audio,Afrodamus,LIMITED EDITION LEO ROMERO'S,Single or Album,02:38,2019
QM-EU3-20-00004,QMEU32000004,Audio,Afrodamus,RARE BOTTLE OF BUBBLES,Single or Album,02:15,2019
QM-EU3-20-00005,QMEU32000005,Audio,Afrodamus,JUNK FOOD JUNKIE,Single or Album,01:52,2019
QM-EU3-20-00006,QMEU32000006,Audio,Afrodamus,Cant Leave Without It,Single or Album,02:00,2019
QM-EU3-20-00007,QMEU32000007,Audio,Afrodamus,What WE On,Single or Album,02:21,2019
"When you release additional songs/videos, please contact us for more ISRC codes at 1-404-869-0701 or www.ISRC.com",,,,,,,
"For help embedding your ISRC codes into your audio or video files, please click here.",,,,,,,